0,former versace store clerk sues over secret 'black code' for minority shoppers
0,the 'roseanne' revival catches up to our thorny political mood
1,mom starting to fear son's web series closest thing she will have to grandchild
1,boehner just wants wife to listen
0,j.k. rowling wishes snape happy birthday in the most magical way
0,advancing the world's women
0,the fascinating case for eating lab-grown meat
0,this ceo will send your kids to school
1,top snake handler leaves sinking huckabee campaign
0,friday's morning email: inside trump's presser for the ages
0,airline passengers tackle man who rushes cockpit in bomb threat
0,facebook reportedly working on healthcare features and apps
0,north korea praises trump and urges us voters to reject 'dull hillary'
0,actually
0,barcelona holds huge protest in support of refugees
1,nuclear bomb detonates during rehearsal for 'spider-man' musical
1,cosby lawyer asks why accusers didn't come forward to be smeared by legal team years ago
1,stock analysts confused
0,bloomberg's program to build better cities just got bigger
0,craig hicks indicted
1,courtroom sketch artist has clear manga influences
1,trump assures nation that decision for syrian airstrikes came after carefully considering all his passing whims
0,qatar deporting dutch woman who reported she was drugged and raped
0,this is why you shouldn't go to the circus
0,ted cruz hits the panic button: 'we could lose both houses of congress'
0,why writers must plan to be surprised
0,obama visits arlington national cemetery to honor veterans
1,ex-con back behind bar
1,after careful consideration
0,remembrance is the beginning of the task
0,allies: islamist motive for killing nemtsov is nonsense
0,gillian jacobs on what it's like to kiss adam brody
0,uber vows to repay nyc drivers 'tens of millions' after tax snafu
0,apple may have poached electric motorcycle company to death
0,drug-resistant bacteria often lurk in children's
0,if you see a muslim at the airport
1,giant altoid heading toward earth
0,'moana' sails straight to the top of the box office with massive $81.1 million opening
0,selig counted money while baseball lost the next generation of fans
1,robin williams inflicted on holiday moviegoers for eighth straight year
0,devin nunes vows to 'never' reveal source of surveillance claims
0,scott used to stop breathing nearly 40 times an hour. this device changed his life
1,rescuers heroically help beached garbage back into ocean
0,medics drop soccer player from stretcher; he's ticked
0,give the gift of play this holiday season
1,christian bale visits sikh temple victims
0,spicer denies that ending maternity care guarantee would mean women pay more for health care
1,'right to live life in complete
1,nasa now almost positive mars is rocky
1,monster undeterred by night-light
0,diy: sports equipment closet
0,1 dead
1,longtime teacher retires without changing a single student's life
0,donald trump heading for a series of wins in the northeast
1,new 'star wars' film once again disappoints die-hard nien nunb fans
1,bats shooed out of nation's waterslide tunnels in preparation for summer
1,mobile news crew reports on own van breaking down
0,un rights chief calls humanitarian situation in syria 'an outrage'
0,how to track santa claus' flight around the world this christmas eve
1,obama has colorado appraised
1,trouble again in tv's africa
1,brita unveils new in-throat water filters
1,report: john grisham slowly but surely climbing list of greatest living american authors
1,ghost can't make a simple cup of coffee without everyone freaking out
1,tupperware will never truly recover from red curry leftovers
0,one of the planet's most powerful forces for change? an adolescent girl
0,how does draymond green take his game to the next level? by tuning in to the wnba
1,area woman said 'sorry' 118 times yesterday
0,ryan lochte apologizes for behavior in rio
1,north dakota not heard from in 48 hours
0,4 lessons prison taught me about power and control
1,sick fucks line up to gape at dead body
0,what is america's first muslim fraternity really like?
0,the vicious knot of syria
0,this congressman thinks we can fix the economy by drinking beer
1,breast implants found to cause problems in laboratory mice
0,trump orders strikes on syria in retaliation for chemical attack
1,ceo's funeral a networking dream
0,year-round schooling: how it would help minority students
0,90 zen teachers pledge to change culture that fosters abuse
0,nypd weighs allowing chokeholds following eric garner death
1,sonny bono foundation prevents at-risk youths from skiing into trees
0,pope francis reminds the world that caring for the earth is everyone's responsibility
1,6-year-old cries when told mtm productions kitten dead by now
1,ex-boyfriend just thought he'd check in and throw entire day off
1,doctors restore ken burns' full-color vision after removing massive tumor from filmmaker's visual cortex
0,'gravity' & '12 years a slave' tie at 2014 pga awards
0,for national coming out day
0,john oliver lays out the most disturbing ways in which trump impacts america
0,house gop crackdown continues
1,'i must make sure you have the skills to please my grandson
1,man visiting hometown amazed to find all his childhood insecurities still there
0,look: world cup star attacked by giant bug
1,clinton becomes first president to clear 18 feet in pole vault
1,hunter s. thompson shoots mouth off one last time
0,inhofe's grand climate conspiracy theory: it's all about barbra streisand
0,5 questions i wish younger people would stop asking me
0,albuquerque shooter on the loose; gunman leaves 1 dead
0,what it's like to lose everything in a flood
0,demi lovato drops emotional 'nightingale' music vid
0,miley cyrus and liam hemsworth smooch on nye
1,jealous gps clearly wants man to back over wife
0,'parks and rec' star natalie morales comes out as queer
0,the top italy tours for 2015
0,kaia gerber
1,l.a. grants clippers $12 for new nets
0,james corden roasts david beckham for matching outfits with posh
0,mcdonald's says its packaging will be 100 percent green by 2025
0,kris jenner turned all the way up for drunken valentine's day karaoke
1,whale regrets eating 290
0,texas ebola patient 'fighting for his life'
1,'is it too late to audition?' asks perfect actor for role
1,robert de niro to turn 58 for movie role
0,scott pruitt (sort of) answers whether trump believes in climate change
0,accused father and son urinal thieves flushed out by cops
1,'just take it slow
0,3 libertarians fuel $7 million super pac in philadelphia's mayoral democratic primary
0,air force will no longer require 'so help me god' in enlistment oaths
1,paul newman dies after consuming 51 hard-boiled eggs
1,yak chews thoughtfully
1,man worried about drug dealer who's not picking up phone
1,dad recommends hotel 10 miles away from city you're visiting
0,explosion fells building outside paris
0,the source of donald trump's military expertise finally revealed!
0,union claims sanders campaign staffers posed as members to influence workers
0,seattle mayor's accuser in sex-abuse lawsuit comes forward
1,southern comfort comforts southerner
0,swedish police featured in film shown by fox news say they were selectively edited
0,chromat features not 1
0,councilman calls on baltimore rappers to inspire students
0,10 qualities of your inner spirit
1,chubby jewish boy dreams of one day being next apatow muse
0,the only parenting advice i'd dare to give
1,family chooses different dog than reincarnated grandfather
0,celebrities celebrate fourth of july with some fun in the sun
0,international women's day: will "western women save the world"?
0,michelle phan
0,caitlyn jenner responds to ricky gervais' golden globes jokes
0,joy behar responds to michael flynn guilty plea with pure joy
0,6 things no one tells women about their weight loss journey
1,fan disappointed to learn l. ron hubbard scientologist
1,marriage breaks up over procreative differences
0,ne-yo helps to raise $2.3 million for california engineering school
0,elizabeth warren calls donald trump a 'racist bully'
0,six dead
1,fox news problem solvers in way over their heads
0,kim gordon clarifies her comments on lana del rey and feminism
1,bashar al-assad tries tiny bit of sarin gas on self to see what it's like
0,my niece has cancer and i'm ticked about it
0,supermodel stephanie seymour arrested
0,scoliosis: what you need to know
0,controversy erupts after uk retailer removes gender labels from kids' clothes
1,teacher bitches about paycheck to sixth-grade class
1,area insurance salesman celebrates 14th year of quoting fletch
1,friends always on best behavior around neil labute
1,man vows never to watch another sci-fi movie with physicist friend
1,biologists announce they're all done with rodents
0,megyn kelly on donald trump: 'i have done my level best to not make this story about me'
0,the secret behind a one day project going viral
0,creating leverage where none seems to exist
1,new movie taps into nation's love of rapping kangaroos
1,newspaper starting to worry spending so much time on facebook not healthy for it
0,the lawsuit against black lives matter and the central meaning of the first amendment
1,vatican putting out feelers for how public would react to another children's crusade
0,'the wire' cast reunited in baltimore to uplift community
0,obama's supreme court nominee just bragged about sending this man to prison. now he's free.
0,death of d.c. man in security guard custody ruled a homicide
0,boehner vows to leave successor with clean slate
1,trump makes last-minute push to appeal to whites
0,facing rising seas
1,all of child's fondest memories times when dad trying to make up for things
0,the worst place in the world for a child
0,mom sentenced for encouraging boyfriend's sex assault on baby
0,donald trump's assault on our values
0,the women's march inspired them to run. now they're unseating gop men.
0,was it worth it
0,gop senators aren't ready to accept trump as their champion
0,price-gouging pharma ceo takes over cancer company
1,man failing to heed harsh lessons of past orders sonic bacon cheeseburger toaster
1,ken burns completes documentary about fucking liars who claimed they watched entire 'jazz' series
1,magic-markered initials fail to deter breakroom rice-cake thief
0,'straight outta compton' is a stunning surprise
0,carly rae jepsen just released her new single
1,god humbled to be the answer to 'jeopardy!' clue
1,female barista getting a lot better at avoiding touching male patrons' hands when they pay
0,gunman kills one
1,couple at point where they're comfortable using toilet at same time
0,mountain lion tracked by scientists is found dead near malibu road
0,noah cyrus makes her late-night debut belting out 'make me (cry)'
1,scalia goes on abortion bender after being passed over for chief justice
1,campbell's unveils one big can-sized noodle
1,is area man going to finish those fries?
0,taylor swift used a 'gremlin voice' while writing '1989'
1,restaurant's eating challenge rewards any patron who can consume reasonably portioned meal
1,fun sticker placed on child's ventilator
0,the best way to eat avocados: avocado pasta
1,that one mcdonald's plate from the '70s: holy shit
0,an open letter to progressives: tpp is not yet 'the most progressive trade agreement in history'
1,modern-day lancelot offers to pay for abortion
1,united airlines offering immigrants special flights that circle u.s. awaiting gaps in travel ban
1,sun thinking of just collapsing now and getting this all over with
0,justice thomas' wife calls supreme court retirement report 'bogus'
1,trump retweets video from anti-muslim hate group
1,long-silent facebook friend comes out of woodwork with post asking about insulating windows
1,struggling airline helped by friendly giant
0,7 ways to breakup like a boss
0,sure seems like frankie muniz wants a 'malcolm in the middle' reboot
0,using the united fiasco to flourish in the future
1,unemployed sibling makes last push for group mother's day gift
1,3822 voted america's favorite pin number
0,thank a teacher thursday: dominic casulli and the power of encouragement
0,a toe in the arctic ocean: canada's northwest territories on the looney front
0,'it will never happen to me'
1,mark zuckerberg cited for contempt of congress after refusing to shut the fuck up about how he started company in dorm room
0,rubio supporters get in a scuffle with a 'rubiobot'
0,the music of strangers: a film review by dr. lloyd sederer
1,'dsm-5' updated to accommodate man who is legitimately being ordered to kill by the moon
1,purina debuts new 'slovenly feast' for nasty-ass shelter cats
0,obama chides darrell issa for touting alliance with him in re-election fight
0,pope francis' iraq peace message meets the reality of war
0,'ant-man and the wasp' trailer brings the fun after 'avengers: infinity war'
1,frontier airlines tells customers to just fucking deal with it
0,moses and the red sea
1,everyone forgets to bring swimsuits to coworker's party
0,george takei accused of groping former male model in 1981
1,new york times adds color to target under-70 demographic
0,the hollywood boys' club that supports casey affleck is a total disgrace
0,3 myths about low libido
1,girl scouts rocked by 'cookies for cash' fundraising scandal
1,christian juggler regrets years wasted as secular juggler
0,huffpollster: americans see progress
0,world will miss goal for universal education by 50 years: un
0,jennifer lopez's name is jennifer lopez again
0,how to rebuild your credit after bankruptcy -- fast
0,discover how climate change is rapidly transforming our earth with google timelapse
1,man who does everything at last minute wonders how you do it
1,conrad bain steps down as national kitsch-reference laureate
0,amanda slavin: not just a statistic
0,laurie hernandez and val chmerkovskiy are already our favorite 'dancing with the stars' couple
0,new photos show hurricane matthew's path of destruction in haiti
0,florida lawmakers vote to ban marriage under the age of 17
1,nasa inadvertently launches unmanned space shuttle
0,nick viall is no longer a 'bachelor'
0,why america demonizes its teachers
1,new instant lottery game features three ways to win
1,podcast a cry for help
0,fashion designer peter som's legendary minestrone soup recipe
0,photography series spotlighting iconic women over 70 proves the best is yet to come
1,clairvoyant vince vaughn accepts movie role before it's offered
0,report kenan thompson is leaving 'snl' deemed 'inaccurate'
0,woman hid heroin
0,'don't cry for me'
0,isis and the g-41 world
1,melania trump hangs decayed badger carcass over white house mantel to finish off traditional slovenian christmas decor
1,woman who admits to having watched golden globes thinks jodie foster embarrassed herself
0,sarah huckabee sanders defends trump's sexist attack on kirsten gillibrand
0,saying goodbye to hollywood's hottest
1,bush increasingly focused on how revisionist history will see him
0,11 years later: the human genome paves the way for genomic technonlogy
0,man claiming to be boko haram leader appears in new video
0,how do i live knowing proof of heaven?
0,on pilgrimage in india
0,will religious freedom advocates oppose roy moore?
0,uaw
0,if bernie sanders wanted to solve problems like donald trump
0,there is no right way
1,rest of evening spent declaring asshole not going to ruin evening
0,north carolina doesn't seem to want people to see police camera footage
0,the education department officially won't deal with transgender students experiencing bathroom discrimination
0,why we won't be participating in black friday
1,hooded members of congress drown another love child in potomac to prevent affair from getting out
0,merkel: isis poses major risk to europe
1,alcoholic kindergarten teacher stretches naptime to three hours
1,report: store out of good kind
0,devastating floods leave 23 dead in west virginia
0,obama's greatest oratory performance
1,grandmother palms grandson $10 like she fixing boxing match
1,bumper nilla crop spells profit for wafer growers
0,6 summer salads you'll actually crave
0,the black keys new album 'turn blue' is now available to stream in full
0,isis vs isil -- what's in a name?
1,national trust for historic preservation to pay for andy rooney's upkeep
1,list of names on gchat sidebar like a portal into area man's past lives
0,tomi lahren is suing glenn beck and theblaze
0,greg hardy unapologetically denies domestic abuse allegations
0,tourists describe scenes of horror in tunisian beach massacre
0,trump voters blink
0,photos from 'ahs' set may help explain all those creepy blond children
1,study: more couples delaying divorce until kids old enough to remember every painful detail
1,never-before-heard buzzword flying around office can't be good
1,man not certain what any of his coworkers' names are
0,psychologists push for smartphone warning labels
1,clinton receives 400
1,scavenger-hunt party 'not leaving without twine'
0,the republican obamacare dilemma in one 6-minute video
0,mass graves suggest systematic killing of rohingya in myanmar
1,final german u-boat surrenders to allied powers
0,private prison companies will still lock up immigrants
1,woman's head feared lost forever inside infinity scarf
1,fed-up brookstone body-massage chair now only entertaining serious buyers
1,trump asks entire senate to clear out of chamber so he can speak to comey alone
0,grateful dead lyricist
1,new report finds americans most interested in science when moon looks different than usual
1,'new york times' moves all content you won't give a shit about unless you make at least $200k a year into one convenient section
0,philippines president calls on civilians to kill drug addicts
0,woman perfectly breaks down why she's not 'just' a nurse
1,chicago police department to monitor all interactions with public using new bullet cams
0,amid the chattering of the global elite
0,at least 23 ethical issues are dogging epa administrator scott pruitt
0,won't ask
1,weird black dot actually part of bowl
0,vegas
0,people really like kanye's new song 'real friends' because it's really g.o.o.d.
0,20 suede pieces you'll want to wear all spring
1,fcc sentences artie lange to death
0,behold the title of 'american horror story' season 7
0,football-loving americans harassed for wearing turbans to nfl game
0,to your health
1,new job posting on craigslist clearly for secretary of the interior
0,seth meyers loses it over thanksgiving's proximity to christmas
0,15 ways the knicks can trade carmelo anthony
0,parents fight to save their two daughters after tragic diagnosis
0,the quiet practice where i found my voice
1,fcc assures nation their favorite verizon websites won't be affected by net neutrality repeal
0,everyone told me my second child would be so much harder than my first
1,report: it still nowhere near okay to act like donald trump
0,man reportedly unleashes trump-inspired anti-lgbtq rant at church
1,white sprinter finishes fifth
0,how i'm finding my voice with wendy davis
1,obama begins inauguration festivities with ceremonial drone flyover
1,lindsay wagner to star in anything offered her
1,democratic senator strides down corridors of powerlessness
0,here's how trump's rage campaign opened the door to the james comey firing
0,looking for happiness in all the wrong places
0,swarm of 100 drones dance to beethoven's 'symphony no. 5' in the night sky
1,fatal school bus crash cements bff status
1,no-makeup look easier to achieve than elle claims
0,the outfit that got this woman kicked out of her school's gym
1,bluetooth headset worn throughout date
1,breakroom tension at all-time high following mug dispute
1,depression symptom checklist speaking to area man as no poem ever could
1,parents formally announce transfer of expectations to second child
0,'saturday night live' celebrates halloween with spooktacular montage
1,steven spielberg: can his career be salvaged?
1,local laundromat employs social media coordinator
1,partygoer vows to fix keg
1,right to own handheld device that shoots deadly metal pellets at high speed worth all of this
1,oscar countdown 2002 begins
0,disaster movies are tame compared to what happened 3.3 billion years ago
0,washington d.c. officer shoots woman carrying knife
0,in your face: the hidden history of plastic surgery and why looks matter
0,a knicks' fan's open letter to santa
1,wolf blitzer decks boston man who hasn't been healed by red sox baseball
0,donald trump and america's blood sport of choice
0,time to end subsidies that are destroying forests
0,netflix to shut down planned louis c.k. comedy special
0,trump undercuts easy obamacare attack with dig about bill clinton's infidelities
1,narcissist mentally undresses self
0,we got the exclusive look at hillary's dnc speech notes
0,watch john kasich lead an awkward david bowie sing-along
1,pro governing: is it faked?
0,how a social media detox helped ed burns become more productive
1,outdoor movie guest excited to watch barely audible 'back to the future' while sitting on tree root
0,north korea claims it's planning to fire missiles near guam
1,gorillagram employee shot by white house security
0,how do i make my 4-month-old fall in love with reading?
0,15 weirdest things that people have left behind in an uber
0,arkansas executes first inmate in 12 years
1,meet the other baldwin brother
0,a sadder pride because of washington inaction
1,brad pitt stumbles across old cardboard box with gwyneth paltrow's head in attic
0,shonda rhimes on the motivation behind her weight loss journey
0,obama plans to tackle major education inequality
0,teaching
0,fashion-forward pigeon sports bread necklace in bold style choice
0,video relaunches investigation into death of man held by chicago police
0,whoopi goldberg says the oscars 'can't be that racist' because she won once
1,housefly tracks dog shit all over cucumber slice
1,hillary clinton opens new presidential library charting course of purely theoretical tenure as commander in chief
1,bounty
0,sherman alexie says artists under trump will be 'noise-canceling headphones'
1,visibly flu-stricken choir kid really dragging down whole christmas pageant
0,nbc news correspondent ayman mohyeldin returning to gaza
1,tim robbins tired of being typecast as relatively tall characters
0,sen. tom cotton thinks 'tough guy' trump is ready to resume waterboarding
1,leather-clad ted cruz greeting voters at reno-area fetish club
1,man's family rises to record-high fourth priority
0,mike ditka has not been paying attention to history
1,what mom would have wanted evolving over course of funeral planning
1,simple task of going to post office feels like weight of 10
1,report: some crazy shit probably happened to classmate being raised by grandmother
0,ivanka trump incorrectly names judaism as 1 of the 3 'largest world religions'
0,rescued lion has been obsessed with blankets since he was a baby
1,county fair judges blown away by heifer
0,the best toys to shop on prime day for kids of all ages
0,the sanders phenomenon
1,clinton staff readies emp launch to disable all nation's electronic devices
0,khloe kardashian joins 'waist gang'
0,next week's republican debate in utah canceled
0,a trove of 'lost and found' photos reveal one mystery couple's beautiful life
0,bear family pool party is the cutest backyard invasion ever
0,dustin hoffman accusers speak out about alleged abuse in joint nbc interview
0,another open letter to betsy devos from a public school teacher
0,6 tips to boost your career
0,video shows transphobic man preaching in target getting shut down by customer
0,#xmasgiftsfromtrump wish list will give trump a very un-merry christmas
0,ronda rousey eerily predicted how she would lose
1,police release haircut-progressed photo of missing woman
0,a brief (pun intended) history of lawyers in movies
0,gifs: the memphis grizzlies weathered this epic oklahoma city thunder storm
1,stomach sets aside synthetic additives until it has a few minutes to figure out how to digest them
0,russia denies it has compromising information on donald trump
0,what comics can offer to bible readers
0,breaking uniform
1,congress approves of $250 billion
0,7 fascinating but forgotten facts from world war i (new book)
1,taylor swift now dating watertown boat
1,rapture wreaks havoc on local book club
0,the key to setting achievable goals
0,the only shopping guide for cyber monday you need
0,donald trump says refugee crisis and threats to uk identity drove brexit
1,science fiction writer admits unstoppable killing machine based on mother
0,gunman kills at least two american advisers in kabul shooting
0,kris kobach defends using a private email for government business
1,10-year-old denies girl-liking allegations
1,stray dad found in lumber section of the home depot
1,office manager unveils new rule
0,charles darwin and the sunmine
0,another way companies make it harder for new mothers
1,sheets changed after every breakup
0,want to make meetings more productive? start walking
1,man overjoyed he no longer has to purchase entire day's worth of egg mcmuffins in morning
0,watch: stone brewing evacuates as wildfire approaches
0,military prosecutor: senate report on cia interrogation program is accurate
0,national park service studies historic lgbtq sites for possible recognition
0,safeguarding america's health system from sabotage
1,jonathan safran foer guesses it's time to give up on silly little dream of becoming good writer
0,skydiver luke aikins makes jump without a parachute
1,study: universe actually shrunk by about 19 inches last year
1,power-crazed orkin man burns house to ground
1,couple's fucked-up presex ritual involves tucking both kids into bed
0,will all senate republicans kowtow to trump and the far right?
0,viral photo captures incredible moment between police officer
1,google employees disappointed 15th anniversary party only has one solar-powered lego drag race reffed by david pogue
