1,authorities not even going to bother looking for motive behind oregon shooting
0,music lives
1,time running out on second-keg fund drive
0,science
1,paul ryan cuts $120 million in wasteful spending from romney campaign
0,trevor noah exposes vladimir putin's sinister actions towards u.s. diplomats
1,closed shop in gentrifying neighborhood to emerge from chrysalis as beautiful gastropub
1,lindsey buckingham asks for more screaming at stevie nicks in monitor
0,lin-manuel miranda and the rock made a musical parody about millennials
0,why democrats should block every trump supreme court justice
0,bernie sanders holds back tears as brother memorializes their parents during dnc vote
1,doll real estate agent glosses over giant hinged opening in middle of house
1,north korea nukes self in desperate plea for attention
1,slovenian 8th-graders surprised even they outperformed u.s. students in science
1,woman has no business being an extrovert
0,design in startups from the get-go
1,handshake comes in at unusually high angle
0,oregon lawmaker groped women at state capitol
1,area mom disappointed no one noticed mastectomy
0,paul lepage wants to bring back the guillotine for drug traffickers
0,marcellus williams prosecutor drew scrutiny in ferguson police shooting
1,dzhokhar tsarnaev courtside at pacers-heat game
0,lauren conrad shares 4 simple rules for dealing with pregnant women
1,man who plays devil's advocate really just wants to be asshole
0,hong kong protesters clash with police near government headquarters
0,bill clinton shoots down republicans: 'i strongly supported' obamacare
0,when we celebrate our differences
0,'walking dead' actor responds to backlash over shocking death
0,american airlines merger settlement approved by u.s. judge
1,report: gen x irony
0,'black panther' star michael b. jordan wants his killmonger's hairstyle to become a trend
1,local man puts rehab behind him
0,after learning about homelessness
0,ellen goes hetero for halloween!
1,real-life pepe le pew rapes cat
1,crowd of voters cheers patronizing rhetoric
0,black mother speaks out: african-american boys 'won't ever really be safe'
0,the simple mind trick that helped me lose weight
1,department of 'homeland' urges all americans to watch this week's episode
0,gop poisoned zika bill to satisfy 'crazies
0,women share stories of sexual assault to show trump what rape culture looks like
0,stephen colbert mocks lawmakers for talking porn instead of guns
0,rocks thrown at police after killing allegedly armed man
1,child's favorite restaurant also dad's favorite bar
1,tapas arriving too fast
0,josh earnest's first wh briefing didn't end so well
1,mike pence asks waiter to remove mrs. butterworth from table until wife arrives
1,city councilman from future warns against building 12th avenue rec center
0,let's take u.s. nukes off hair-trigger alert before we blow up the planet
0,tarantino-style 'star trek' trailer shows us the wonderful potential
0,chrissy teigen wants you to survive your post-election thanksgiving
0,goliath opens his wallet: a new era for cuba and the united states
0,new series on 'the secret life of muslims' aims to subvert stereotypes
1,'bad to the bone' to be used in film
0,plane diverted after ebola virus reclines in seat
0,nick offerman's satirical video shows the sad state of school lunches
0,young performer jade pettyjohn of nickelodeon's school of rock is in new film with katee sackhoff
1,social media startup looking for smug little fuck to take leadership role
1,nitroglycerin chex gingerly pulled from shelves
0,these fashion grandpas could not be more adorable
0,taylor swift wins video of the year for 'bad blood' at 2015 vmas
0,alaska wife steals patrol car holding hubby
1,american public clarifies rational
1,proud father teaches son how to shave eyebrows for first time
0,the hypocrisy underlying brazil's impeachment movement
1,area woman almost imagines taste of peppermint mocha on tongue but stops herself
1,roomba thrown out of home after being caught staring at sleeping daughter
0,the 'here comes honey boo boo' scandal: mama june speaks out
1,pigeon's route accommodated
1,subway employee still unnerved by high-pitched screech sandwiches make when cut in half
0,solar jobs report shows huge growth
1,all y'all urged to go fuck yo' selves
0,the science behind why celebrities like ryan lochte tell fibs
0,senate bill may answer a decades-old request
0,fan grabs world series home run from another fan to throw it back
0,the gop's big lie about tax cuts
0,'3 generations' stars discuss the power of telling trans stories
0,sea lion yanks man off boat in effort to snatch fish
0,gwen stefani and blake shelton take their love to the billboard music awards
0,monday's morning email: the aftermath of the worst mass shooting in u.s. history
0,healthcare is confusing part iii: the uninsured and serious illness
1,cancer walk goes under 15-straight miles of high tensile power lines
0,what's the matter with eastern europe? welcome to the birthplace of trumpism
1,l.a. adds high-speed chase lane to freeway
0,jenny slate has the best college story ever
0,white terror demands white action: what allies need to do right now for charlottesville
0,4 crazy-good kebab recipes
1,'game of thrones' fan rewatching past episodes to remind self of what characters' breasts look like
0,california's brutal drought could change the state forever
0,and now
0,the dark history of birth control
1,area woman marries into health insurance
1,new climate change report just list of years each country becomes uninhabitable
0,teenage pro surfer reportedly killed catching hurricane irma's waves in barbados
0,nypd: muslim woman set on fire just before 9/11 anniversary
1,report: spider
0,save this season: the best underwear multipacks
1,best thing that ever happened to area man yelling at him about socks
1,heroin addicts pressure president to stay course in afghanistan
0,roger ailes' lasting legacy: making trump president
0,10 of the best beauty buys from sephora's vib spring sale
0,zuckerberg to trump: time for a reality check on immigration
0,playing monopoly with our lives
1,area article nauseous from constant scrolling
1,maid dreams children will one day be maids in wealthier households
1,apple fans demand other products they can feel directly against skin at all times
0,has alzheimer's been cured?
1,parking lot attendant seemingly unaware new day a gift from god
0,beauty queen scarfs down 12 krispy kreme doughnuts in no time
0,arianna joins payoff to 'reshape' financial services industry
0,no african citizens could attend a summit on african trade after visas denied
1,new blog piece on woody allen to settle everything
0,satirical video highlights how white and male dominated hollywood truly is
0,an iowa teenager didn't wreck his state's health care market. here's who did.
1,new pre-sauced napkins can be thrown away straight from package
0,look: iconic jean company introduces gay pride line
1,all the cheapest items on wedding registry already purchased
1,barbara bush calls white house to see if she can leave husband there for few hours
1,radicals
1,man surprised to hear himself tell matt damon he's a 'big fan'
0,susan cooper
0,getting children out of poverty requires a two-generation approach
1,road sign over-explains highway's dangers
0,holy mother of all that is good
1,cheney returns to u.s. with full head of thick
1,area cockroach fucking huge
0,rupaul comes under fire for comments about openly trans contestants on 'drag race'
1,crazed loiterer strikes again
1,report finds more americans putting off children until companies are ready
1,tibetan teen getting into western philosophy
0,8 life lessons you can learn from bruce springsteen
0,photos show aftermath of colombia's deadly floods
0,chris christie
0,run
0,in aftermath of northern california fires
1,'i'm going to hell for laughing at this meme
1,world bank forecloses on world farm
0,vulnerable republicans just showed why fighting for trans rights is a political winner
0,women who write about tech are still being abused online
0,why terrible news really might keep you up at night
0,women are using iconic anti-mobster law to go after harvey weinstein
1,michael jordan displeased with this week's burnt offerings
1,anne hathaway
1,man nothing but lumbering golem of rewards cards
0,news roundup for august 23
0,the nixonization of donald trump
1,u-haul offers discount for customers who will just move back home in 18 months after failure to make it in major city
0,10 easy-to-tackle super bowl sweets
1,paul hogan keeps pitching crocodile dundee saturday-morning cartoon
0,the smithereens lead singer pat dinizio dead at 62
0,this muffuletta dip is the one recipe you need to make this weekend
0,wearable sensors can tell if you're sick before you even feel it
0,ten years after last execution
0,angela merkel will seek fourth term as german chancellor
0,the best italian winter salads have a surprising thing in common
0,charlize theron makes a villain out of vin diesel in this 'fate of the furious' clip
1,grounded plane makes snow angel on tarmac
0,why it's so much better to buy experiences than things
1,well-meaning mouse wouldn't really call self a 'pest
0,trump will not campaign for roy moore in alabama
0,paul ryan's health care plan doesn't really eliminate the individual mandate
1,heartbroken chris brown always thought rihanna was woman he'd beat to death
0,'conscious uncoupling is wimping out' and 14 other life lessons
1,hillary clinton suspended 3 weeks by fec for spitting on volunteer
1,tragic oscar-night camera malfunction leaves seven critically underpublicized
1,americans outraged amazon's punishing work culture has yet to yield same-day shipping for all products
0,on 18th birthday
0,car crashes straight through restaurant window
0,trump says he's expanded his proposed muslim ban
0,a drug company is putting work-life balance before profit. cool.
1,inhibitions found in seedy motel room
0,here's your chance to attend kobe bryant's last game
0,a magical island: making the most of your novel's setting
1,on-the-job sexual harassment: three women tell their sizzling hot tales
1,white house announces sasha obama to now be played by britney watkins
0,epic doug the pug music video compilation is giving us lyfe
0,here's exactly why a vote for trump is vote against lgbtq rights
1,dnc takes out full-page ad thanking alabama's working-class white voters
0,search underway after disneyland guest with autism drops lanyard while collecting pins
1,report: more americans turning to louder sources for their news
1,trump pours milk over bowl of skittles while settling in to watch comey hearing
1,area man determined to make the best of situation comedy
1,nasa designers release flirty new space skirt
0,the way you remember winters of yore is probably wrong
1,new lover features 30 percent more cock
1,new nervous-energy drink recreates feeling of waiting for girl to call
1,friend whose mom just died allowed to pick pizza topping
1,lottery winner burns money in faces of poor children
0,everyone loves alternative facts
0,how to get good with money in a year
1,photograph of little girl being absorbed into michelle obama portrait goes viral
1,study: only 40% of mice have little welcome mat
0,floor pizza and the new mediocrity
0,hpv rates are going way down for young women
0,will greater israel transform into greater palestine?
1,chuck e. cheese's announces new lower prices
1,new desktop folder created for sad little creative project
1,senator trying to make long-distance relationship work with constituency back home
0,celebrities send love to london with touching social media messages
1,dance cage recidivism rates at all-time high within american club scene
0,sharon tate's sister rips 'tacky' hilary duff film about manson family murder
1,lazy
0,a song for bruce rauner
0,trump administration adds more foreign guest worker visas
1,god-knows-what to take place in rural cabin
0,the scientology-approved version of 'going clear' is a bit... different
1,man just needs to power through another day of not being broke and unemployed
1,larry nassar: 'who among us hasn't made a mistake repeatedly and with wild
1,family fears grandmother aware of her surroundings
1,study finds cats only meow when they want to alert owner of neighbor's murder they witnessed through window
0,inside bernie worrell's all-star nyc benefit
0,house of cards-style corruption in virginia
0,'100 years of italian beauty' is a bellissima trip back in time
0,china disputes trump's claims of fentanyl 'flood' into united states
1,elderly couple dresses up for trip to denny's
0,how to overcome the stress of long distance relationships
0,bill o'reilly compares #blacklivesmatter movement to gestapo
0,overburdened mental health providers thwart police push for drug treatment
0,lena dunham defends 'girls' writer accused of raping 17-year-old
0,apple
0,2015 u.s. best ranked cities for hotels
1,report: putting head in hands and moaning quietly still best way to get through next several seconds
0,meet the young people trying to make sure detroit's rebirth works for everybody
0,china excludes same-sex couples from domestic violence law
1,catholic church condemns metrosexuality
1,boss wants to know if you can work late this year
0,lac megantic remembers canadian oil train disaster
0,vladimir putin
0,the first 'rogue one' trailer is a 'star wars' nerd's dream
1,vengeance-minded glacier just biding time until next ice age
1,once-loyal enabler betrays man by suggesting therapy
1,reverend al sharpton takes time off from holy duties to make tv appearance
0,ravens take out rival steelers in playoff grudge match
0,why we should value (but not worship) reason
1,aerobics show used for almost completely non-aerobic purpose
0,an open and personal email to hillary clinton from a contemporary
0,jon stewart co-hosts sportscenter to support wounded veteran athletes
1,goldfish teetering on edge of sanity
0,chrissy teigen poses in her bra with teddy bear post-met gala
0,i was
0,women in business q&a: paula kavolius
1,military recruiter upset area man hasn't called him back
1,syrian man kept up all night by neighbors dying
1,olympic speed skater thinking about maybe taking out the garbage
1,every book on area woman's shelves somehow related to coping
0,the global deal: a new economic consensus
1,viewers impressed by how male trump looked during debate
0,greece orders banks to re-open monday
0,24 movies you'll want to see over the remainder of 2017
0,pizza hut's new 'skinny slice' isn't quite a dream come true
0,read the full text of sally yates' letter opposing donald trump's muslim ban
1,pneumonia virus terrified after remembering what clintons capable of
0,france to ban domestic production of oil and gas by 2040
1,prospective student had most fun getting drunk at arizona state
1,trailblazing colleague makes historic contact with people who work on other floor
0,what the paris attack is really about (hint -- neither free speech nor the varied nature of muslims)
1,dr. scholl's introduces line of sexy lace insoles
1,weakling president asks imaginary man in sky to bless nation
1,trump honors sacrifices civil rights activists will have to make under his presidency
0,carrie fisher remembered as fans celebrate 'star wars day'
0,supreme court to consider lifting class-action bar for millions of workers
1,stunning e3 announcement reveals new video game consoles to phase out graphics entirely
1,working artist has developed thick skin for sound career advice
0,a 2
1,wacky morning zoo crew dj threatened by younger
1,oh
0,comedian janet silverman talks 89 d*ck picks
1,maid of honor specifically selected for ability to take emotional beating
0,lena heady goes dark and dramatic for the 2014 emmys
1,radio talk-show caller to make point
0,health officials confirm second case of plague from yosemite
0,citizens ask: how many guns do we need?
1,child's description of heaven during near-death experience specifically mentions book deal
0,bask in the awkward disaster that was justin timberlake and anna kendrick's 'trolls' premiere
1,gene wilder's career in ruins following death of richard pryor
1,more vegetables evolving chocolate-sauce-filled centers as evolutionary imperative
1,man ashamed of himself after cashier reads food order back to him
0,a christmas miracle
0,what's for breakfast? how about some monsanto weed killer?
0,leaked cables contradict clinton's claims on tpp trade agreement
0,hall & oates inducted into rock and roll hall of fame (video)
1,lazy daredevil to lie across 12 couches
0,paul ryan embraces trump's executive order
0,here are all the 2018 grammy winners
0,13 reasons to feel hopeful during a rough month
0,how one gym is helping people get in touch with their feelings
0,run towards (not away from) trump's america: the problem is global
0,a commodore computer from the 1980s is still heating schools in michigan
1,congressman checks in real quick with ethics office to make sure pressing exposed penis against intern doesn't constitute sexual harassment
0,parkland could've been worse. vegas could've been worse. they can always be worse.
1,shape magazine declares july 'let yourself go' month
1,family wishes dad could find healthier way to express emotions than bursting into full-blown musical number
1,scientists successfully create artificial placenta that tastes just as delicious as real one
0,time for a brand new site for israel-palestine peace talks
0,venezuela hunts for rogue helicopter attackers
1,dad's been on a parenting kick lately
0,simple ways to easily save over $600 a year
1,queen elizabeth frantically trying to preserve european alliances by arranging great-grandchildren's marriages
0,woman hires hitman because her grandkids got lice
0,rihanna doesn't care about dark circles
0,nigel
0,photographer mourns her lost children in touching series
0,ted cruz upsets donald trump in maine republican caucus
1,area bus driver would prefer not to say 'you're welcome' for thousandth time today
0,iran vows 'firm response' unless obama stops sanctions renewal
1,freshness escaping from bag of peas
1,gentle ben biographer's shocking new book reveals famous bear's 28-pine-marten-a-day habit
1,nation curious after discovering mysterious
1,nasa to send earth into space
1,target demographic growing up right before wistful advertiser's eyes
0,katy perry awarded $1.57 million from entrepreneur who interfered with convent sale
1,report: texting while driving okay if you look up every couple seconds
0,princeton students confront university president over woodrow wilson's legacy
1,governor lashes out against cheap scotch
1,department of transportation allocates $400 million for national shortcut
1,no one in gang has heart to tell police informant his cover's blown
1,john kerry throws vine over pit of quicksand to save child companion
0,jimmy fallon gets heartfelt after revealing he almost lost his finger
1,dome-home sales somehow manage to dip even lower
0,it's election season
0,holy guacamole! people in new zealand are stealing avocados
1,new 'do not kill' registry to allow americans to opt out of being murdered
1,nation fondly recalls when just regulating video games seemed like solution to gun violence
0,5 things men can do to strengthen their relationship
0,is this a quote from donald trump or dialogue from porn?
1,independent baking scene apparently worth a documentary
0,huffpost taste's instagram: what's new
0,rhea maceris' gps guide on feeling empowered
1,new study finds women should only be making 20 cents less on dollar than men
1,scientists discover perfect little out-of-the-way place
0,despite its remoteness
0,hawaii missile alert update delayed because governor didn't know his twitter password
0,texas mom outraged because her daughter's school won't allow sunscreen
1,cloned cheney lacks charm of original
0,big brothers big sisters honors nbc entertainment's jennifer salke with sherry lansing award
0,tribe prepares to keep up pipeline protest through north dakota winter
0,'f**k muzlim' and 'terroist' spray-painted on muslim man's car
0,teen jumps on whale shark like it's nbd
0,leadership matters: gratitude leads to greatness
1,new evidence suggests first gallows created as early attempt at autoerotic asphyxiation
1,last civil war tortoise dies
0,clergy abuse advocates fear pope francis is making it harder for victims to speak up
1,silvio berlusconi transferred to steamy all-female penitentiary
0,steve bannon is even worse than you thought
1,man on vacation suddenly realizes no one feeding his hostages
0,a model for the future: funding the end of childhood illness together
0,why we're still fighting the last war on trade policy
0,spring on spring street: a tale of rebirth
0,what?! fish can't be organic?
1,man realizes he has no interests
0,10 of the funniest boomer tv moments ever
1,dad announces plan to honk when he's out front
1,keynote speaker enlightens entire generation with theme that world is changing
0,the largest demographic of binge drinkers might surprise you
1,temperature of coffee expected to rise nine degrees by end of 21st century
0,dozens of leads
0,kidnapping suspect says vaccine's side effects led him to crime
0,bill maher jokes about what donald trump will really be doing on his asia trip
1,ben stiller peels banana with own feet
1,cute new dog helping single man pick up tons of hot shit
1,terminally ill friend not much fun anymore
0,why emotional intelligence affects the bottom line
1,r.a. has bad feeling about kid in cloak
0,how marvel beat dc at the movies
0,delta airlines has its first black female captain
0,farewell to jean nidetch
0,dear patricia arquette
1,rosetta stone offers new spanish language course for pandering presidential candidates
0,dick masturbates in tickle creek: cops
1,world health organization: 'not sure how
1,lucrative new oil extraction method involves drilling directly into gas stations
0,stephen colbert brings down the house with his explanation for trump's actions
0,holly madison releasing memoir about life in the playboy mansion
0,ben & jerry's new flavor 'empower mint' is more political and punny than ever
0,this man's tweets cryptically pay homage to a smash mouth classic
0,bird poo is the worst flavor of ice cream
0,aziz ansari offers donald trump simple advice on combating hate crimes
0,14 things 'parks & recreation' taught us about food
0,betsy devos sued for weakening sexual assault reporting protections for students
1,'access hollywood' reporter vows to get to very surface of story
0,college scorecard sandbags equity in higher education
0,dolce & gabbana launched a line of hijabs and abayas
0,5 common medicare mistakes and how to avoid them
0,history is made as rams officially sign michael sam to 4-year multi-million dollar contract
1,goodwill employees shaken by gigantic pants
0,the tim kaine i know
0,why email is microsoft's secret weapon
0,how the u.k. government ignored offers to take in more lone children
0,'one blow could change.. life': boxer overcame rough childhood to become inspiring athlete
0,donald trump raises the stakes for a potential debate with bernie sanders
1,woman wearing jacket indulging in forbidden pleasure of having pockets
0,congressional climate deniers represent 63 percent of americans
0,donald trump names rex tillerson secretary of state
0,more than 5
0,here's why the internet is convinced kylie jenner is having a baby boy
0,donald trump expects the media to do what he wants -- because it often does
1,genetically modified chicken lays its own dipping sauce
0,e. coli outbreak linked to chipotle spreads to 3 more states
1,pack of harpies ordered their crostini literally 20 minutes ago
1,pentagon ripped off by shady weapons dealer
1,friends can't stand couple's public displays of hostility
1,2018 the year it all going to fall into place
0,18 electric wedding kisses that will leave you weak in the knees
1,los angeles now 70 percent overpasses
1,abandoned mall retains eerie vestiges of fun shopping atmosphere
0,alaska airlines employee calls tomi lahren 'tami
0,conservative pundit s.e. cupp hits trump white house right in the balls
0,morgan spurlock admits history of sexual misconduct
0,time magazine's rape crisis article
1,man pledges loyalty to brand in quiet convenience store ceremony
1,shoe scientists unveil advanced 'double knot' technology
0,why going abroad isn't always rainbows and butterflies
1,monsanto develops hardier strain of corn that yields 4 times normal litigation
0,georgia to provide planned parenthood with free std test kits again
0,on the anniversary of trump's inauguration
1,italian grandmother doesn't have heart to tell family any dipshit can make lasagna
1,generous military sends $800 in disability to man who wakes up screaming every night
0,woman who accused bill clinton of sexual assault joins anti-hillary pac
1,obama finally reveals nature of his work to daughters
1,shitty human being blames decreased daylight this time
1,'to defeat them
0,how i learned to get naked with strangers again after my mastectomy
1,report: all things aside
1,study: 90% of plane landings just barely pulled off
1,middle-aged couple sick of 31-year-old son always trying to set them up with other parents
0,how one dying man changed the debate about the tax bill
1,frantic biden searching dog shelter for bo look-alike
1,investigation confirms nbc management had no knowledge of misconduct in matt lauer's network-sanctioned sex dungeon
0,actor michael rapaport takes a knee
0,preemie mom photographs the 'emotional turmoil' of 'the nicu roller coaster'
0,man arrested after attempting to breach cockpit during flight to honolulu
1,abby sunderland - concocted history's most extreme plan to get out of a summer job
0,whatsapp co-founder to leave company amid disagreements with facebook
0,stephen king rips donald trump in his scariest horror story yet
0,missing just 2 hours of sleep quadruples your risk of a car accident
